{"id":"inc_Ee4Ee4Ee4Ee4Ee4Ee4","job_id":"job_Cc2Cc2Cc2Cc2Cc2Cc2","source_id":"src_Bb1Bb1Bb1Bb1Bb1Bb1","observation_ids":["obs_Dd3Dd3Dd3Dd3Dd3Dd3"],"zone_version":1,"reasons":[{"code":"DWELL_IN_ZONE","text":"Una persona permaneció 4,5 s dentro de la zona declarada."}],"unknowns":["CAPTURE_TIME_UNKNOWN","IDENTITY_NOT_ASSESSED","INTENT_NOT_ASSESSED"],"context":{"requested":{"start_ms":0,"end_ms":39500},"effective":{"start_ms":0,"end_ms":39500},"truncated_start":true,"truncated_end":false,"clip_available":true,"derivative_mapping_proven":true},"stills":[{"id":"stl_Hh7Hh7Hh7Hh7Hh7Hh7","pts_ms":16000,"sha256":"cccccccccccccccccccccccccccccccccccccccccccccccccccccccccccccccc","bbox_norm":[0.4,0.5,0.1,0.3]}],"review_state":"PENDING","revision":1,"origin":"service_analysis"}
